workId,lang,actId,sceneId,placeId,placeRecode,coord,settingText,time,comments
167,als,0,0,,,,D'Handlung spielt im Hüüs vum Herr Hirsch.,,
168,als,0,0,,,,"D'Scène stellt e Wirthstub vor. Hinte e Diehr wo in e Schloofzimmer füehrt. D'Fenster vom Schloofzimmer gehn uf d'Stub erüs. Rechts zwei Zimmerdiehre, links d'Hüsdiehr.",,
312,als,0,0,,,,"Ort der Handlung: Wohnung vom Herr Buttemües.
Zit: Gegewart.",around 1898,
318,als,0,0,,,,"D'Scene stellt e freier Platz vor; im Hintergrund sin e paar Staffle. Mittle uf dr Scene steht d'Milhusinà im e griechische Costüm; rechts: d'Poesie, d'Posse, 's Dràmà un 's Schauspiel, links: d'Prosà, 's Lustspiel, 's Volksstück un dr Schwank.",,
321,als,0,0,18,,,"Ort der Handlung: Gâwiller un d'r Platz vorm Belchewirtshus.
Zeit: Gegenwart.",around 1900,
323,als,0,0,4,,,"Ort der Handlung: Colmar im Elsaß.
Zeit: Gegenwart.",around 1900,
182,als,0,0,,,,La scène se passe chez le sultan.,,
